[{"id":"obs.sankashti-chaturthi","kind":"monthly","title":{"te":"సంకష్టహర చతుర్థి","hi":"संकष्टी चतुर्थी","en":"Sankashti Chaturthi"},"rule":{"masam":null,"masa_n":null,"paksha":"krishna","tithi":4,"prevails_at":"chandrodaya"},"regions":["all"],"deity":"ganesha","links":{"pujas":[],"texts":["ganesha.mula-mantra","ganesha.ashtottara"],"naivedyam":["nv.modaka"]},"image":"img.obs.sankashti-chaturthi","status":"draft","sections":{"special":{"te":"ప్రతి నెల కృష్ణపక్ష చవితి. కష్టాలు తొలగించే గణపతిని తలచుకునే రోజు.","hi":"हर महीने कृष्ण पक्ष की चतुर्थी। कष्ट दूर करने वाले गणपति के स्मरण का दिन।","en":"The fourth day of every waning moon — a day to remember Ganapati, who eases difficulties."},"families_do":{"te":"కొందరు పగలు ఉపవాసం ఉండి, చంద్రోదయం తర్వాత గణపతి పూజ చేసి, చంద్రునికి అర్ఘ్యం ఇచ్చి భోజనం చేస్తారు. ఉపవాసం తప్పనిసరి కాదు.","hi":"कुछ लोग दिन में व्रत रखकर चंद्रोदय के बाद गणपति पूजा करते हैं, चंद्रमा को अर्घ्य देकर भोजन करते हैं। व्रत अनिवार्य नहीं है।","en":"Some fast through the day, worship Ganapati after moonrise, offer water to the moon and then eat. Fasting is never required."},"history":null,"regional_notes":null}},{"id":"obs.vinayaka-chavithi","kind":"festival","title":{"te":"వినాయక చవితి","hi":"गणेश चतुर्थी","en":"Vinayaka Chavithi"},"rule":{"masam":"bhadrapada","masa_n":6,"paksha":"shukla","tithi":4,"prevails_at":"madhyahna"},"regions":["all"],"deity":"ganesha","links":{"pujas":["ganesha.puja.vinayaka-chavithi"],"texts":["ganesha.ashtottara","ganesha.mula-mantra"],"stories":["ganesha.story.elephant-head","ganesha.story.moon","ganesha.story.mango"],"naivedyam":["nv.modaka","nv.phala"]},"image":"img.obs.vinayaka-chavithi","status":"draft","sections":{"special":{"te":"వినాయకుని పుట్టినరోజుగా జరుపుకునే పండుగ. ఏడాదిలో మొదటి పెద్ద పండుగ — అన్ని పనులకు ముందు ఆయనను పూజించినట్లే.","hi":"गणेश जी के जन्मदिन के रूप में मनाया जाने वाला पर्व — जैसे हर काम से पहले उनकी पूजा, वैसे ही त्योहारों की शुरुआत भी उन्हीं से।","en":"Celebrated as Ganesha's birthday — just as every task begins with him, the festival season begins with him too."},"families_do":{"te":"మట్టి గణపతిని తెచ్చి, పాలవెల్లి కట్టి, 21 పత్రాలతో పూజ చేసి, ఉండ్రాళ్ళు నివేదిస్తారు. పిల్లలు పుస్తకాలు, పెన్నులు పూజలో పెడతారు. రాత్రి చంద్రుణ్ణి చూడకుండా ఉంటారు.","hi":"मिट्टी के गणपति लाकर, 21 पत्रों से पूजा कर, मोदक का भोग लगाते हैं। बच्चे किताबें और कलम पूजा में रखते हैं। रात को चंद्रमा न देखने की परंपरा है।","en":"Families bring home a clay Ganapati, worship him with 21 kinds of leaves and offer modakas. Children place their books and pens in the puja. Many avoid looking at the moon that night."},"history":{"te":"గణపతిని మొదట పూజించే సంప్రదాయం వేదకాలం నుంచి ఉంది. 1893లో పుణెలో లోకమాన్య తిలక్ ఈ పండుగను అందరూ కలిసి జరుపుకునే సామూహిక ఉత్సవంగా మార్చారు; అప్పటినుంచి వీధుల్లో మండపాలు వెలిశాయి.","hi":"गणपति की प्रथम पूजा की परंपरा वैदिक काल से है। 1893 में पुणे में लोकमान्य तिलक ने इसे सबके साथ मिलकर मनाने वाला सार्वजनिक उत्सव बनाया; तब से गलियों में पंडाल सजने लगे।","en":"Worshipping Ganapati first is a tradition from Vedic times. In 1893 in Pune, Lokmanya Tilak turned the festival into a public celebration for everyone; street pandals have followed ever since."},"regional_notes":{"te":"మహారాష్ట్రలో 10 రోజుల ఉత్సవం, అనంత చతుర్దశి నాడు నిమజ్జనం. ఆంధ్ర-తెలంగాణలో పాలవెల్లి, ఉండ్రాళ్ళు; తమిళనాడులో కొళుకట్టై; కర్ణాటకలో గౌరీ పండుగ ముందురోజు.","hi":"महाराष्ट्र में 10 दिन का उत्सव और अनंत चतुर्दशी पर विसर्जन। आंध्र-तेलंगाना में पालवेल्लि और उंडराल्लु; तमिलनाडु में कोळुकट्टै; कर्नाटक में एक दिन पहले गौरी पर्व।","en":"Maharashtra celebrates for ten days, with immersion on Ananta Chaturdashi. Andhra and Telangana have the palavelli and undrallu; Tamil Nadu, kozhukattai; Karnataka celebrates Gowri the day before."}}}]